{
  "schemaVersion": 1,
  "batchMonth": "2026-10",
  "published": true,
  "sample": false,
  "statements": [
    {
      "id": "2026-10-courts-justices-green-1",
      "topicId": "courts-justices",
      "partyId": "green",
      "speaker": "Green Party of California",
      "speakerTitle": "State party of the Green Party of the United States (statement published on gp.org)",
      "quote": "In a massive blow to civil rights, in its recent ruling in Louisiana v. Callais, the Supreme Court, made it much harder for minoritized voters to challenge redistricting maps under the 1965 Voting Rights Act. The ruling allows states more power in drawing districts for partisan gain.",
      "date": "2026-06-18",
      "sourceUrl": "https://www.gp.org/juneteenth_a_celebration_interrupted",
      "sourceTitle": "Juneteenth; A Celebration Interrupted (Green Party of the United States, gp.org)",
      "verifiedAt": "2026-09-26"
    },
    {
      "id": "2026-10-courts-justices-libertarian-1",
      "topicId": "courts-justices",
      "partyId": "libertarian",
      "speaker": "Libertarian Party of Wisconsin",
      "speakerTitle": "State affiliate of the Libertarian Party (press release)",
      "quote": "The Court correctly recognized that political speech does not lose its constitutional protection simply because it is coordinated between a political party and the candidates it exists to support. ... Today’s ruling reaffirms a simple constitutional principle: the First Amendment protects political expression, regardless of whether that expression comes from individuals, candidates, or political parties.",
      "date": "2026-07-01",
      "sourceUrl": "https://urbanmilwaukee.com/pressrelease/libertarian-party-of-wisconsin-applauds-supreme-court-decision-protecting-political-speech/",
      "sourceTitle": "Libertarian Party of Wisconsin Applauds Supreme Court Decision Protecting Political Speech (Urban Milwaukee press release)",
      "verifiedAt": "2026-09-26"
    },
    {
      "id": "2026-10-courts-justices-democratic-1",
      "topicId": "courts-justices",
      "partyId": "democratic",
      "speaker": "Dick Durbin",
      "speakerTitle": "U.S. Senator from Illinois; Senate Democratic Whip; Ranking Member, Senate Judiciary Committee",
      "quote": "The declaration from this Supreme Court in this case [Louisiana v. Callais] as well as the political position of many of my colleagues is: ‘we don’t need it anymore; we don’t have discrimination anymore.’ I don’t believe that’s true. The basic question we have to ask ourselves is whether or not we are denying Americans who are qualified and legally eligible to vote an opportunity to do so.",
      "date": "2026-05-19",
      "sourceUrl": "https://www.judiciary.senate.gov/press/dem/releases/durbin-delivers-opening-statement-on-the-trump-administration-supreme-courts-continued-attacks-on-voting-rights-during-a-senate-judiciary-subcommittee-hearing",
      "sourceTitle": "Durbin Delivers Opening Statement On The Trump Administration, Supreme Court’s Continued Attacks On Voting Rights During A Senate Judiciary Subcommittee Hearing (Senate Judiciary Committee)",
      "verifiedAt": "2026-09-26"
    },
    {
      "id": "2026-10-courts-justices-republican-1",
      "topicId": "courts-justices",
      "partyId": "republican",
      "speaker": "Chuck Grassley",
      "speakerTitle": "U.S. Senator from Iowa; Chairman, Senate Judiciary Committee",
      "quote": "House Democrats have said that four new justices are needed – expanding the Court from nine to 13 – because the number of justices should match the number of federal appellate circuits. That might make sense if the Supreme Court hadn’t operated with nine Justices since 1869 – for over 150 years! ... Additional circuits haven’t been a reason to add justices for nearly a century. It still isn’t today.",
      "date": "2026-06-09",
      "sourceUrl": "https://www.judiciary.senate.gov/press/rep/releases/grassley-sounds-the-alarm-on-democrats-intentions-to-pack-the-supreme-court",
      "sourceTitle": "Grassley Sounds the Alarm on Democrats’ Intentions to Pack the Supreme Court (Senate Judiciary Committee)",
      "verifiedAt": "2026-09-26"
    },
    {
      "id": "2026-10-safety-security-green-1",
      "topicId": "safety-security",
      "partyId": "green",
      "speaker": "Green Party of the United States",
      "speakerTitle": "National party (press release)",
      "quote": "We strongly oppose this illegal act of war which violates both the US Constitution and international law. ... The Party urges the Senate to vote on the resolution scheduled for next week to halt military intervention.",
      "date": "2026-01-03",
      "sourceUrl": "https://www.gp.org/green_party_condemns_trump_attack_on_venezuela",
      "sourceTitle": "Green Party Condemns Trump Attack On Venezuela (Green Party of the United States, gp.org)",
      "verifiedAt": "2026-09-26"
    },
    {
      "id": "2026-10-safety-security-libertarian-1",
      "topicId": "safety-security",
      "partyId": "libertarian",
      "speaker": "Jules Cutler",
      "speakerTitle": "Chair, Libertarian Party of Iowa",
      "quote": "Iowa has watched limited missions turn into 20-year wars before. ... Our Guard members have sacrificed enough in undeclared conflicts. If this operation expands, Congress owes Iowa families an open debate and a recorded vote—before, not after, our troops are committed.",
      "date": "2026-01-03",
      "sourceUrl": "https://lpia.org/2026/01/03/4249/",
      "sourceTitle": "Libertarian Party of Iowa Demands Congressional Vote on Venezuela Military Action (Libertarian Party of Iowa)",
      "verifiedAt": "2026-09-26"
    },
    {
      "id": "2026-10-safety-security-democratic-1",
      "topicId": "safety-security",
      "partyId": "democratic",
      "speaker": "Jack Reed",
      "speakerTitle": "U.S. Senator from Rhode Island; Ranking Member, Senate Armed Services Committee",
      "quote": "Nicolás Maduro is a brutal autocrat who has destroyed Venezuela's economy, crushed democratic opposition, and presided over pervasive corruption. Nothing in his record warrants defense. ... This has been a profound constitutional failure. Congress – not the President – has the sole power to authorize war.",
      "date": "2026-01-03",
      "sourceUrl": "https://www.reed.senate.gov/news/releases/reed-statement-on-us-military-raid-in-caracas-and-trumps-claim-to-run-venezuela",
      "sourceTitle": "Reed Statement on U.S. Military Raid in Caracas and Trump’s Claim to Run Venezuela (Office of Sen. Jack Reed)",
      "verifiedAt": "2026-09-26"
    },
    {
      "id": "2026-10-safety-security-republican-1",
      "topicId": "safety-security",
      "partyId": "republican",
      "speaker": "Roger Wicker",
      "speakerTitle": "U.S. Senator from Mississippi; Chairman, Senate Armed Services Committee",
      "quote": "I commend President Trump for ordering a successful mission to arrest illegitimate Venezuelan dictator Nicolas Maduro and bring him to the United States to face justice. Our military performed an incredibly complex mission with characteristic precision and professionalism.",
      "date": "2026-01-03",
      "sourceUrl": "https://www.wicker.senate.gov/2026/1/chairman-wicker-commends-president-trump-u-s-military-and-law-enforcement-for-successful-mission-to-arrest-maduro",
      "sourceTitle": "Chairman Wicker Commends President Trump, U.S. Military and Law Enforcement for Successful Mission to Arrest Maduro (Office of Sen. Roger Wicker)",
      "verifiedAt": "2026-09-26"
    },
    {
      "id": "2026-10-trust-democracy-green-1",
      "topicId": "trust-democracy",
      "partyId": "green",
      "speaker": "Green Party of the United States",
      "speakerTitle": "National party (press release on the State of the Union)",
      "quote": "Reject Trump’s massive assault on election integrity while enacting reforms such as Ranked Choice Voting, proportional representation, and full public campaign financing",
      "date": "2026-02-27",
      "sourceUrl": "https://www.gp.org/greens_say_the_current_state_of_the_union_is_appalling",
      "sourceTitle": "Greens say the current State of the Union is appalling (Green Party of the United States, gp.org)",
      "verifiedAt": "2026-09-26"
    },
    {
      "id": "2026-10-trust-democracy-libertarian-1",
      "topicId": "trust-democracy",
      "partyId": "libertarian",
      "speaker": "Evan McMahon",
      "speakerTitle": "Chair, Libertarian National Committee",
      "quote": "When a third party gathers a record number of signatures and earns its place on the ballot, the answer is to debate them, not to bully them, bribe them, or sue them off the ballot.",
      "date": "2026-06-11",
      "sourceUrl": "https://lp.org/libertarian-party-condemns-gop-intimidation-campaign-against-ballot-qualified-iowa-candidates/",
      "sourceTitle": "Libertarian Party Condemns GOP Intimidation Campaign Against Ballot-Qualified Iowa Candidates (Libertarian Party, LP.org)",
      "verifiedAt": "2026-09-26"
    },
    {
      "id": "2026-10-trust-democracy-democratic-1",
      "topicId": "trust-democracy",
      "partyId": "democratic",
      "speaker": "Alex Padilla",
      "speakerTitle": "U.S. Senator from California; Ranking Member, Senate Rules and Administration Committee",
      "quote": "Under the Constitution and laws enacted by Congress, the Postal Service is an independent agency, and Americans rely on it to deliver the mail, including ballots, without partisan political interference. ... Even worse, tens of millions of eligible voters could be prevented from voting by mail if states do not fully submit to this new federal mandate being rushed ahead of the 2026 election.",
      "date": "2026-05-29",
      "sourceUrl": "https://www.padilla.senate.gov/newsroom/press-releases/padilla-statement-on-uspss-proposed-rule-to-implement-trumps-unlawful-vote-by-mail-executive-order/",